{
  "task_id": "voxel_forest_guardian_avatar_001",
  "category": "single_turn",
  "difficulty": "hard",
  "scene_id": "forest_cabin_001",
  "prompts": [
    "Sculpt a chunky forest guardian player avatar with wood armor, moss-stone body, and a cloud mask."
  ],
  "target_artifact": "voxel_builder",
  "gold_voxel_builder": {
    "spec_version": "0.1",
    "request_id": "voxel_forest_guardian_avatar_001::prompt_0",
    "intent_id": "voxel_forest_guardian_avatar_001::prompt_0::intent_0",
    "operation": "create",
    "target_object_id": null,
    "base_object_version": null,
    "object_category": "avatar",
    "size_tier": "medium",
    "style_tags": ["forest", "guardian", "chunky", "player_avatar"],
    "behaviors": [],
    "grid": {
      "unit_meters": 0.5,
      "up_axis": "y",
      "rotation_step_degrees": 90
    },
    "placement": {
      "mode": "absolute",
      "reference_object": null,
      "relation": null,
      "offset": [0, 0, 0]
    },
    "materials": [
      {
        "material_id": "wood",
        "tags": ["natural", "armor"]
      },
      {
        "material_id": "moss_stone",
        "tags": ["body", "forest"]
      },
      {
        "material_id": "cloud",
        "tags": ["mask", "face"]
      }
    ],
    "anchors": [],
    "operations": [
      {
        "op_id": "left_boot",
        "kind": "add_box",
        "position": [-0.9, 0.35, 0],
        "size": [1.1, 0.7, 1.1],
        "material_id": "wood",
        "tags": ["boot", "left"]
      },
      {
        "op_id": "right_boot",
        "kind": "add_box",
        "position": [0.9, 0.35, 0],
        "size": [1.1, 0.7, 1.1],
        "material_id": "wood",
        "tags": ["boot", "right"]
      },
      {
        "op_id": "left_leg",
        "kind": "add_box",
        "position": [-0.9, 1.55, 0],
        "size": [0.9, 1.7, 1],
        "material_id": "moss_stone",
        "tags": ["leg", "left"]
      },
      {
        "op_id": "right_leg",
        "kind": "add_box",
        "position": [0.9, 1.55, 0],
        "size": [0.9, 1.7, 1],
        "material_id": "moss_stone",
        "tags": ["leg", "right"]
      },
      {
        "op_id": "torso",
        "kind": "add_box",
        "position": [0, 3.2, 0],
        "size": [2.8, 3.2, 1.8],
        "material_id": "moss_stone",
        "tags": ["torso", "body"]
      },
      {
        "op_id": "shoulders",
        "kind": "add_box",
        "position": [0, 4.35, 0],
        "size": [4.4, 0.9, 1.9],
        "material_id": "wood",
        "tags": ["shoulders", "armor"]
      },
      {
        "op_id": "left_arm",
        "kind": "add_box",
        "position": [-2.1, 3.15, 0],
        "size": [0.95, 2.8, 0.95],
        "material_id": "wood",
        "tags": ["arm", "left"]
      },
      {
        "op_id": "right_arm",
        "kind": "add_box",
        "position": [2.1, 3.15, 0],
        "size": [0.95, 2.8, 0.95],
        "material_id": "wood",
        "tags": ["arm", "right"]
      },
      {
        "op_id": "head",
        "kind": "add_box",
        "position": [0, 5.65, 0],
        "size": [1.9, 1.9, 1.7],
        "material_id": "cloud",
        "tags": ["head", "mask"]
      }
    ],
    "compile_hints": {
      "preferred_runtime": "primitive_parts"
    },
    "diagnostics": []
  },
  "scoring_profile": {
    "profile_id": "default_v1",
    "weights": {
      "schema_validity": 0.25,
      "action_type": 0.25,
      "argument_match": 0.30,
      "spatial_match": 0.20
    },
    "hard_fail_on_schema_invalid": true
  },
  "metadata": {
    "paraphrase_group": "forest_guardian_voxel_builder"
  }
}
